smartctl 6.6 2016-05-31 r4324 [x86_64-linux-5.4.0-149-generic] (local build)
Copyright (C) 2002-16, Bruce Allen, Christian Franke, www.smartmontools.org

=== START OF INFORMATION SECTION ===
Model Number:                       Samsung SSD 980 500GB
Serial Number:                      S64DNU0WC14076H
Firmware Version:                   3B4QFXO7
PCI Vendor/Subsystem ID:            0x144d
IEEE OUI Identifier:                0x002538
Total NVM Capacity:                 500,107,862,016 [500 GB]
Unallocated NVM Capacity:           0
Controller ID:                      5
Number of Namespaces:               1
Namespace 1 Size/Capacity:          500,107,862,016 [500 GB]
Namespace 1 Utilization:            476,568,014,848 [476 GB]
Namespace 1 Formatted LBA Size:     512
Local Time is:                      Sat Feb 24 22:59:07 2024 CST
Firmware Updates (0x16):            3 Slots, no Reset required
Optional Admin Commands (0x0017):   Security Format Frmw_DL *Other*
Optional NVM Commands (0x0055):     Comp DS_Mngmt Sav/Sel_Feat *Other*
Maximum Data Transfer Size:         512 Pages
Warning  Comp. Temp. Threshold:     82 Celsius
Critical Comp. Temp. Threshold:     85 Celsius
Namespace 1 Features (0x10):        *Other*

Supported Power States
St Op     Max   Active     Idle   RL RT WL WT  Ent_Lat  Ex_Lat
 0 +     5.24W       -        -    0  0  0  0        0       0
 1 +     4.49W       -        -    1  1  1  1        0       0
 2 +     2.19W       -        -    2  2  2  2        0     500
 3 -   0.0500W       -        -    3  3  3  3      210    1200
 4 -   0.0050W       -        -    4  4  4  4     1000    9000

Supported LBA Sizes (NSID 0x1)
Id Fmt  Data  Metadt  Rel_Perf
 0 +     512       0         0

=== START OF SMART DATA SECTION ===
SMART overall-health self-assessment test result: PASSED

SMART/Health Information (NVMe Log 0x02, NSID 0x1)
Critical Warning:                   0x00
Temperature:                        63 Celsius
Available Spare:                    100%
Available Spare Threshold:          10%
Percentage Used:                    11%
Data Units Read:                    2,894,673 [1.48 TB]
Data Units Written:                 93,123,085 [47.6 TB]
Host Read Commands:                 11,614,470
Host Write Commands:                78,405,255
Controller Busy Time:               1,773
Power Cycles:                       1
Power On Hours:                     137
Unsafe Shutdowns:                   0
Media and Data Integrity Errors:    0
Error Information Log Entries:      0
Warning  Comp. Temperature Time:    0
Critical Comp. Temperature Time:    0
Temperature Sensor 1:               63 Celsius
Temperature Sensor 2:               90 Celsius

Read Error Information Log failed: NVMe Status 0x02

../pebblesdb/release/db_bench --db=/mnt/nvme/level8B --num=500000000 --benchmarks=filletc,stats --bloom_bits=10 --cache_size=8388608 --open_files=800000 --histogram=1 --print_wa=true --stats_interval=50000000 --write_buffer_size=67108864 --max_file_size=67108864 --data_file=/home/wangzizhao/workloads/etc_data_zipf1.5.csv 
Keys:       16 bytes each
Values:     300 bytes each (150 bytes after compression)
Entries:    500000000
RawSize:    150680.5 MB (estimated)
FileSize:   79155.0 MB (estimated)
WARNING: Snappy compression is not enabled
------------------------------------------------
Recover Time : 18446744073709545003
InitializeFileLevelBloomFilter Time: 1
InitializeTableCacheFileMetaData Time: 2
PebblesDB Open Time: 18664
Write buffer: 65536.00 KB
Recover Time : 18446744073709545980
InitializeFileLevelBloomFilter Time: 1
InitializeTableCacheFileMetaData Time: 1
PebblesDB Open Time: 17633
Entering ETC workload testing:
2024/02/24-23:02:00  ... thread 0: (50000000,50000000) ops and (290077.7,290077.7) ops/second in (172.367607,172.367607) seconds
50000000 operations have been finished (0.000 MB data have been written into db)

                               Compactions
Level  Files Size(MB) Time(sec) Read(MB) Write(MB)
--------------------------------------------------
  0        1       54       110        0     16600
  1        2       16        20    16546      1191
  2        2       33         6     1176       816
  3        0        0         5      817       563
  4        2       39         3      657       449
  5       11      201         2      282       201
WriteAmplification: 1.1940

2024/02/24-23:04:53  ... thread 0: (50000000,100000000) ops and (289486.4,289781.8) ops/second in (172.719673,345.087280) seconds
100000000 operations have been finished (0.000 MB data have been written into db)

                               Compactions
Level  Files Size(MB) Time(sec) Read(MB) Write(MB)
--------------------------------------------------
  0        2      109       222        0     33310
  1        2       16        41    33201      2390
  2        2       32        13     2374      1647
  3        4       68        10     1649      1140
  4        4       64         6     1166       802
  5       14      224         6      733       525
  6       14      121         1      179       121
WriteAmplification: 1.1989

2024/02/24-23:07:44  ... thread 0: (50000000,150000000) ops and (292867.6,290803.1) ops/second in (170.725599,515.812879) seconds
150000000 operations have been finished (0.000 MB data have been written into db)

                               Compactions
Level  Files Size(MB) Time(sec) Read(MB) Write(MB)
--------------------------------------------------
  0        0        0       336        0     49963
  1        3       24        61    49963      3599
  2        2       33        19     3575      2480
  3        5       53        16     2520      1737
  4       10      157         9     1740      1202
  5       13      146         8     1113       790
  6       46      317         4      522       389
WriteAmplification: 1.2041

2024/02/24-23:10:38  ... thread 0: (50000000,200000000) ops and (286038.7,289597.2) ops/second in (174.801501,690.614380) seconds
200000000 operations have been finished (0.000 MB data have been written into db)

                               Compactions
Level  Files Size(MB) Time(sec) Read(MB) Write(MB)
--------------------------------------------------
  0        0        0       459        0     66618
  1        0        0        81    66618      4801
  2        3       49        26     4801      3330
  3        2       19        22     3353      2316
  4       10      123        13     2389      1657
  5       12       86        11     1568      1107
  6      103      570         7      961       710
WriteAmplification: 1.2090

2024/02/24-23:13:35  ... thread 0: (50000000,250000000) ops and (283257.3,288306.6) ops/second in (176.517944,867.132324) seconds
250000000 operations have been finished (0.000 MB data have been written into db)

                               Compactions
Level  Files Size(MB) Time(sec) Read(MB) Write(MB)
--------------------------------------------------
  0        1       54       578        0     83327
  1        0        0       101    83273      6001
  2        0        0        34     6001      4163
  3        5       64        28     4235      2928
  4        7       91        16     2956      2050
  5       32      246        14     2040      1438
  6      118      654         8     1095       804
WriteAmplification: 1.2086

2024/02/24-23:16:31  ... thread 0: (50000000,300000000) ops and (283651.9,287520.3) ops/second in (176.272384,1043.404708) seconds
300000000 operations have been finished (0.000 MB data have been written into db)

                               Compactions
Level  Files Size(MB) Time(sec) Read(MB) Write(MB)
--------------------------------------------------
  0        1       54       696        0     99981
  1        0        0       122    99927      7201
  2        0        0        42     7201      4996
  3        2       30        33     5068      3506
  4        7       91        20     3568      2474
  5       11       85        17     2474      1742
  6      112      741        17     2373      1714
WriteAmplification: 1.2164

2024/02/24-23:19:27  ... thread 0: (50000000,350000000) ops and (284106.1,287027.5) ops/second in (175.990588,1219.395296) seconds
350000000 operations have been finished (0.000 MB data have been written into db)

                               Compactions
Level  Files Size(MB) Time(sec) Read(MB) Write(MB)
--------------------------------------------------
  0        1       54       808        0    116635
  1        0        0       142   116580      8402
  2        0        0        48     8402      5829
  3        5       53        38     5901      4084
  4        3       21        23     4154      2877
  5       28      171        20     2949      2076
  6      151      866        21     2840      2089
WriteAmplification: 1.2174

2024/02/24-23:22:20  ... thread 0: (50000000,400000000) ops and (288855.8,287254.8) ops/second in (173.096749,1392.492045) seconds
400000000 operations have been finished (0.000 MB data have been written into db)

                               Compactions
Level  Files Size(MB) Time(sec) Read(MB) Write(MB)
--------------------------------------------------
  0        0        0       924        0    133344
  1        1        8       163   133344      9609
  2        0        0        55     9601      6662
  3        4       34        44     6764      4679
  4       10       91        26     4759      3297
  5       25      150        22     3287      2312
  6      162      949        25     3409      2494
WriteAmplification: 1.2179

2024/02/24-23:25:15  ... thread 0: (50000000,450000000) ops and (286813.8,287205.7) ops/second in (174.329155,1566.821200) seconds
450000000 operations have been finished (0.000 MB data have been written into db)

                               Compactions
Level  Files Size(MB) Time(sec) Read(MB) Write(MB)
--------------------------------------------------
  0        0        0      1044        0    150000
  1        1        8       184   150000     10809
  2        0        0        63    10801      7495
  3        0        0        50     7597      5256
  4       16      161        30     5370      3721
  5       34      210        24     3675      2581
  6      168      958        31     4125      3044
WriteAmplification: 1.2194

2024/02/24-23:28:09  ... thread 0: (50000000,500000000) ops and (286682.7,287153.3) ops/second in (174.408878,1741.230078) seconds
500000000 operations have been finished (0.000 MB data have been written into db)

                               Compactions
Level  Files Size(MB) Time(sec) Read(MB) Write(MB)
--------------------------------------------------
  0        1       54      1163        0    166710
  1        1        8       205   166655     12009
  2        0        0        71    12002      8327
  3        8       68        56     8430      5834
  4        6       76        33     5894      4083
  5       39      192        27     4149      2908
  6      170     1046        37     4949      3652
WriteAmplification: 1.2208

filletc      :       3.482 micros/op 287153 ops/sec;   99.4 MB/s
Microseconds per op:
Count: 500000000 Average: 3.4825  StdDev: 7.26
Min: 1  Median: 1.9671  Max: 706205
Percentiles: P50: 1.97 P75: 2.86 P99: 10.89 P99.9: 67.69 P99.99: 87.13
------------------------------------------------------
[       0,       1 ] 14190090   2.838%   2.838% #
(       1,       2 ] 243839961  48.768%  51.606% ##########
(       2,       3 ] 135815067  27.163%  78.769% #####
(       3,       4 ] 34538302   6.908%  85.677% #
(       4,       6 ] 50276889  10.055%  95.732% ##
(       6,      10 ] 15878207   3.176%  98.908% #
(      10,      15 ]  2607149   0.521%  99.429% 
(      15,      22 ]   974473   0.195%  99.624% 
(      22,      34 ]   285523   0.057%  99.681% 
(      34,      51 ]   218017   0.044%  99.725% 
(      51,      76 ]  1312262   0.262%  99.987% 
(      76,     110 ]    42943   0.009%  99.996% 
(     110,     170 ]     5831   0.001%  99.997% 
(     170,     250 ]     3828   0.001%  99.998% 
(     250,     380 ]     2545   0.001%  99.998% 
(     380,     580 ]      763   0.000%  99.998% 
(     580,     870 ]      130   0.000%  99.998% 
(     870,    1300 ]       24   0.000%  99.998% 
(    1300,    1900 ]       39   0.000%  99.998% 
(    1900,    2900 ]       38   0.000%  99.998% 
(    2900,    4400 ]      986   0.000%  99.999% 
(    4400,    6600 ]     2016   0.000%  99.999% 
(    6600,    9900 ]      199   0.000%  99.999% 
(    9900,   14000 ]       59   0.000%  99.999% 
(   14000,   22000 ]     3029   0.001% 100.000% 
(   22000,   33000 ]     1141   0.000% 100.000% 
(   33000,   50000 ]      250   0.000% 100.000% 
(   50000,   75000 ]       61   0.000% 100.000% 
(   75000,  110000 ]       51   0.000% 100.000% 
(  110000,  170000 ]       50   0.000% 100.000% 
(  170000,  250000 ]       39   0.000% 100.000% 
(  250000,  380000 ]       24   0.000% 100.000% 
(  380000,  570000 ]       10   0.000% 100.000% 
(  570000,  860000 ]        4   0.000% 100.000% 

smartctl 6.6 2016-05-31 r4324 [x86_64-linux-5.4.0-149-generic] (local build)
Copyright (C) 2002-16, Bruce Allen, Christian Franke, www.smartmontools.org

=== START OF INFORMATION SECTION ===
Model Number:                       Samsung SSD 980 500GB
Serial Number:                      S64DNU0WC14076H
Firmware Version:                   3B4QFXO7
PCI Vendor/Subsystem ID:            0x144d
IEEE OUI Identifier:                0x002538
Total NVM Capacity:                 500,107,862,016 [500 GB]
Unallocated NVM Capacity:           0
Controller ID:                      5
Number of Namespaces:               1
Namespace 1 Size/Capacity:          500,107,862,016 [500 GB]
Namespace 1 Utilization:            476,571,152,384 [476 GB]
Namespace 1 Formatted LBA Size:     512
Local Time is:                      Sat Feb 24 23:28:09 2024 CST
Firmware Updates (0x16):            3 Slots, no Reset required
Optional Admin Commands (0x0017):   Security Format Frmw_DL *Other*
Optional NVM Commands (0x0055):     Comp DS_Mngmt Sav/Sel_Feat *Other*
Maximum Data Transfer Size:         512 Pages
Warning  Comp. Temp. Threshold:     82 Celsius
Critical Comp. Temp. Threshold:     85 Celsius
Namespace 1 Features (0x10):        *Other*

Supported Power States
St Op     Max   Active     Idle   RL RT WL WT  Ent_Lat  Ex_Lat
 0 +     5.24W       -        -    0  0  0  0        0       0
 1 +     4.49W       -        -    1  1  1  1        0       0
 2 +     2.19W       -        -    2  2  2  2        0     500
 3 -   0.0500W       -        -    3  3  3  3      210    1200
 4 -   0.0050W       -        -    4  4  4  4     1000    9000

Supported LBA Sizes (NSID 0x1)
Id Fmt  Data  Metadt  Rel_Perf
 0 +     512       0         0

=== START OF SMART DATA SECTION ===
SMART overall-health self-assessment test result: PASSED

SMART/Health Information (NVMe Log 0x02, NSID 0x1)
Critical Warning:                   0x00
Temperature:                        63 Celsius
Available Spare:                    100%
Available Spare Threshold:          10%
Percentage Used:                    11%
Data Units Read:                    2,894,679 [1.48 TB]
Data Units Written:                 93,540,835 [47.8 TB]
Host Read Commands:                 11,615,226
Host Write Commands:                78,783,688
Controller Busy Time:               1,782
Power Cycles:                       1
Power On Hours:                     137
Unsafe Shutdowns:                   0
Media and Data Integrity Errors:    0
Error Information Log Entries:      0
Warning  Comp. Temperature Time:    0
Critical Comp. Temperature Time:    0
Temperature Sensor 1:               63 Celsius
Temperature Sensor 2:               92 Celsius

Read Error Information Log failed: NVMe Status 0x02

