smartctl 6.6 2016-05-31 r4324 [x86_64-linux-5.4.0-149-generic] (local build)
Copyright (C) 2002-16, Bruce Allen, Christian Franke, www.smartmontools.org

=== START OF INFORMATION SECTION ===
Model Number:                       Samsung SSD 980 500GB
Serial Number:                      S64DNU0WC14076H
Firmware Version:                   3B4QFXO7
PCI Vendor/Subsystem ID:            0x144d
IEEE OUI Identifier:                0x002538
Total NVM Capacity:                 500,107,862,016 [500 GB]
Unallocated NVM Capacity:           0
Controller ID:                      5
Number of Namespaces:               1
Namespace 1 Size/Capacity:          500,107,862,016 [500 GB]
Namespace 1 Utilization:            476,560,216,064 [476 GB]
Namespace 1 Formatted LBA Size:     512
Local Time is:                      Sat Feb 24 20:57:50 2024 CST
Firmware Updates (0x16):            3 Slots, no Reset required
Optional Admin Commands (0x0017):   Security Format Frmw_DL *Other*
Optional NVM Commands (0x0055):     Comp DS_Mngmt Sav/Sel_Feat *Other*
Maximum Data Transfer Size:         512 Pages
Warning  Comp. Temp. Threshold:     82 Celsius
Critical Comp. Temp. Threshold:     85 Celsius
Namespace 1 Features (0x10):        *Other*

Supported Power States
St Op     Max   Active     Idle   RL RT WL WT  Ent_Lat  Ex_Lat
 0 +     5.24W       -        -    0  0  0  0        0       0
 1 +     4.49W       -        -    1  1  1  1        0       0
 2 +     2.19W       -        -    2  2  2  2        0     500
 3 -   0.0500W       -        -    3  3  3  3      210    1200
 4 -   0.0050W       -        -    4  4  4  4     1000    9000

Supported LBA Sizes (NSID 0x1)
Id Fmt  Data  Metadt  Rel_Perf
 0 +     512       0         0

=== START OF SMART DATA SECTION ===
SMART overall-health self-assessment test result: PASSED

SMART/Health Information (NVMe Log 0x02, NSID 0x1)
Critical Warning:                   0x00
Temperature:                        65 Celsius
Available Spare:                    100%
Available Spare Threshold:          10%
Percentage Used:                    11%
Data Units Read:                    2,894,650 [1.48 TB]
Data Units Written:                 91,223,169 [46.7 TB]
Host Read Commands:                 11,611,585
Host Write Commands:                76,874,941
Controller Busy Time:               1,695
Power Cycles:                       1
Power On Hours:                     135
Unsafe Shutdowns:                   0
Media and Data Integrity Errors:    0
Error Information Log Entries:      0
Warning  Comp. Temperature Time:    0
Critical Comp. Temperature Time:    0
Temperature Sensor 1:               65 Celsius
Temperature Sensor 2:               95 Celsius

Read Error Information Log failed: NVMe Status 0x02

../pebblesdb/release/db_bench --db=/mnt/nvme/level8B --num=500000000 --benchmarks=filletc,stats --bloom_bits=10 --cache_size=8388608 --open_files=800000 --histogram=1 --print_wa=true --stats_interval=50000000 --write_buffer_size=67108864 --max_file_size=67108864 --data_file=/home/wangzizhao/workloads/etc_data_zipf1.2.csv 
Keys:       16 bytes each
Values:     300 bytes each (150 bytes after compression)
Entries:    500000000
RawSize:    150680.5 MB (estimated)
FileSize:   79155.0 MB (estimated)
WARNING: Snappy compression is not enabled
------------------------------------------------
Recover Time : 18446744073709486588
InitializeFileLevelBloomFilter Time: 1
InitializeTableCacheFileMetaData Time: 0
PebblesDB Open Time: 78429
Write buffer: 65536.00 KB
Recover Time : 18446744073709546753
InitializeFileLevelBloomFilter Time: 1
InitializeTableCacheFileMetaData Time: 0
PebblesDB Open Time: 21434
Entering ETC workload testing:
2024/02/24-21:02:22  ... thread 0: (50000000,50000000) ops and (184362.6,184362.6) ops/second in (271.204710,271.204710) seconds
50000000 operations have been finished (0.000 MB data have been written into db)

                               Compactions
Level  Files Size(MB) Time(sec) Read(MB) Write(MB)
--------------------------------------------------
  0        2      109       227        0     16638
  1        2       65       100    16529      4904
  2        2       81        63     4839      4033
  3       18      399        60     4064      3601
  4       16      474        49     3538      3094
  5       48      631        54     3385      2964
  6      153      979        38     1516      1377
WriteAmplification: 2.2004

2024/02/24-21:07:31  ... thread 0: (50000000,100000000) ops and (162083.1,172506.5) ops/second in (308.483733,579.688443) seconds
100000000 operations have been finished (0.000 MB data have been written into db)

                               Compactions
Level  Files Size(MB) Time(sec) Read(MB) Write(MB)
--------------------------------------------------
  0        2      109       498        0     33332
  1        2       65       229    33223      9852
  2        2       81       139     9787      8158
  3        9      167       152     8190      7276
  4       20      315       128     7556      6450
  5      167     1623       153     7430      6423
  6      491     2492       148     5099      4646
WriteAmplification: 2.2842

2024/02/24-21:12:58  ... thread 0: (50000000,150000000) ops and (152833.6,165409.2) ops/second in (327.153255,906.841698) seconds
150000000 operations have been finished (0.000 MB data have been written into db)

                               Compactions
Level  Files Size(MB) Time(sec) Read(MB) Write(MB)
--------------------------------------------------
  0        1       55       779        0     50080
  1        2       65       357    50026     14846
  2        1        1       221    14781     12318
  3       17      384       246    12439     11062
  4       28      338       210    11355      9617
  5      154      977       245    10672      9191
  6      910     4755       340    11544     10279
WriteAmplification: 2.3441

2024/02/24-21:18:28  ... thread 0: (50000000,200000000) ops and (151521.5,161704.0) ops/second in (329.986169,1236.827867) seconds
200000000 operations have been finished (0.000 MB data have been written into db)

                               Compactions
Level  Files Size(MB) Time(sec) Read(MB) Write(MB)
--------------------------------------------------
  0        2      109      1066        0     66775
  1        3       97       489    66666     19734
  2        2       80       309    19734     16443
  3       11      263       341    16405     14596
  4       52      368       301    15010     12662
  5      161      977       352    13801     11841
  6     1052     6268       583    19212     16924
WriteAmplification: 2.3807

2024/02/24-21:23:57  ... thread 0: (50000000,250000000) ops and (151717.2,159602.8) ops/second in (329.560416,1566.388283) seconds
250000000 operations have been finished (0.000 MB data have been written into db)

                               Compactions
Level  Files Size(MB) Time(sec) Read(MB) Write(MB)
--------------------------------------------------
  0        1       55      1352        0     83522
  1        3       97       622    83467     24665
  2        2       80       397    24568     20477
  3        8      224       436    20520     18261
  4       50      327       400    18813     15843
  5      295     1432       462    17001     14556
  6     1184     7465       823    26628     23353
WriteAmplification: 2.4027

2024/02/24-21:29:51  ... thread 0: (50000000,300000000) ops and (141292.0,156228.4) ops/second in (353.877085,1920.265368) seconds
300000000 operations have been finished (0.000 MB data have been written into db)

                               Compactions
Level  Files Size(MB) Time(sec) Read(MB) Write(MB)
--------------------------------------------------
  0        2      109      1658        0    100215
  1        0        0       767   100106     29566
  2        5      172       492    29566     24636
  3       10      193       535    24626     21924
  4       83      560       517    22536     18952
  5      345     1408       573    20047     17106
  6     1319     8778      1108    34815     30516
WriteAmplification: 2.4239

2024/02/24-21:35:29  ... thread 0: (50000000,350000000) ops and (148001.0,154997.5) ops/second in (337.835549,2258.100917) seconds
350000000 operations have been finished (0.000 MB data have been written into db)

                               Compactions
Level  Files Size(MB) Time(sec) Read(MB) Write(MB)
--------------------------------------------------
  0        1       55      1946        0    116963
  1        2       65       897   116909     34514
  2        0        0       578    34530     28770
  3       23      389       624    28851     25616
  4       81      652       614    26056     21899
  5      295     1142       684    22977     19567
  6     1559    10239      1407    44401     38935
WriteAmplification: 2.4475

2024/02/24-21:41:04  ... thread 0: (50000000,400000000) ops and (149527.0,154291.9) ops/second in (334.387771,2592.488688) seconds
400000000 operations have been finished (0.000 MB data have been written into db)

                               Compactions
Level  Files Size(MB) Time(sec) Read(MB) Write(MB)
--------------------------------------------------
  0        0        0      2227        0    133658
  1        3      110      1026   133658     39406
  2        5       86       664    39419     32841
  3       31      364       711    32831     28942
  4       65      427       705    29460     24803
  5      366     1561       799    26193     22260
  6     1747    11368      1663    52281     45849
WriteAmplification: 2.4522

2024/02/24-21:46:43  ... thread 0: (50000000,450000000) ops and (147268.6,153478.6) ops/second in (339.515591,2932.004279) seconds
450000000 operations have been finished (0.000 MB data have been written into db)

                               Compactions
Level  Files Size(MB) Time(sec) Read(MB) Write(MB)
--------------------------------------------------
  0        1       55      2513        0    150352
  1        3      110      1156   150297     44263
  2        6      163       755    44276     36892
  3       10      132       793    36829     32274
  4      117      775       816    33125     27947
  5      400     1658       900    28922     24551
  6     1891    12529      1913    60399     52993
WriteAmplification: 2.4560

2024/02/24-21:52:27  ... thread 0: (50000000,500000000) ops and (145197.0,152608.2) ops/second in (344.359657,3276.363936) seconds
500000000 operations have been finished (0.000 MB data have been written into db)

                               Compactions
Level  Files Size(MB) Time(sec) Read(MB) Write(MB)
--------------------------------------------------
  0        2      109      2802        0    167100
  1        1       32      1286   166991     49134
  2       10      266       849    49225     41012
  3       13      163       885    40950     35700
  4      124      649       912    36491     30833
  5      299     1187      1004    31915     27044
  6     2211    14301      2206    69906     61361
WriteAmplification: 2.4667

filletc      :       6.553 micros/op 152608 ops/sec;   52.8 MB/s
Microseconds per op:
Count: 500000000 Average: 6.5527  StdDev: 6.04
Min: 1  Median: 2.3618  Max: 1889871
Percentiles: P50: 2.36 P75: 3.18 P99: 12.01 P99.9: 68.40 P99.99: 97.28
------------------------------------------------------
[       0,       1 ]  5962755   1.193%   1.193% 
(       1,       2 ] 178278361  35.656%  36.848% #######
(       2,       3 ] 181761532  36.352%  73.201% #######
(       3,       4 ] 50265587  10.053%  83.254% ##
(       4,       6 ] 57610417  11.522%  94.776% ##
(       6,      10 ] 19760410   3.952%  98.728% #
(      10,      15 ]  3391843   0.678%  99.406% 
(      15,      22 ]  1022306   0.204%  99.611% 
(      22,      34 ]   321481   0.064%  99.675% 
(      34,      51 ]   195194   0.039%  99.714% 
(      51,      76 ]  1336451   0.267%  99.981% 
(      76,     110 ]    69759   0.014%  99.995% 
(     110,     170 ]     5960   0.001%  99.996% 
(     170,     250 ]     1933   0.000%  99.997% 
(     250,     380 ]      698   0.000%  99.997% 
(     380,     580 ]      474   0.000%  99.997% 
(     580,     870 ]      524   0.000%  99.997% 
(     870,    1300 ]      685   0.000%  99.997% 
(    1300,    1900 ]     1095   0.000%  99.997% 
(    1900,    2900 ]     1290   0.000%  99.998% 
(    2900,    4400 ]     1341   0.000%  99.998% 
(    4400,    6600 ]     1442   0.000%  99.998% 
(    6600,    9900 ]      244   0.000%  99.998% 
(    9900,   14000 ]      212   0.000%  99.998% 
(   14000,   22000 ]      680   0.000%  99.999% 
(   22000,   33000 ]     1270   0.000%  99.999% 
(   33000,   50000 ]      759   0.000%  99.999% 
(   50000,   75000 ]      620   0.000%  99.999% 
(   75000,  110000 ]      639   0.000%  99.999% 
(  110000,  170000 ]      848   0.000%  99.999% 
(  170000,  250000 ]      887   0.000% 100.000% 
(  250000,  380000 ]     1103   0.000% 100.000% 
(  380000,  570000 ]      749   0.000% 100.000% 
(  570000,  860000 ]      334   0.000% 100.000% 
(  860000, 1200000 ]       94   0.000% 100.000% 
( 1200000, 1900000 ]       23   0.000% 100.000% 

smartctl 6.6 2016-05-31 r4324 [x86_64-linux-5.4.0-149-generic] (local build)
Copyright (C) 2002-16, Bruce Allen, Christian Franke, www.smartmontools.org

=== START OF INFORMATION SECTION ===
Model Number:                       Samsung SSD 980 500GB
Serial Number:                      S64DNU0WC14076H
Firmware Version:                   3B4QFXO7
PCI Vendor/Subsystem ID:            0x144d
IEEE OUI Identifier:                0x002538
Total NVM Capacity:                 500,107,862,016 [500 GB]
Unallocated NVM Capacity:           0
Controller ID:                      5
Number of Namespaces:               1
Namespace 1 Size/Capacity:          500,107,862,016 [500 GB]
Namespace 1 Utilization:            476,564,992,000 [476 GB]
Namespace 1 Formatted LBA Size:     512
Local Time is:                      Sat Feb 24 21:52:28 2024 CST
Firmware Updates (0x16):            3 Slots, no Reset required
Optional Admin Commands (0x0017):   Security Format Frmw_DL *Other*
Optional NVM Commands (0x0055):     Comp DS_Mngmt Sav/Sel_Feat *Other*
Maximum Data Transfer Size:         512 Pages
Warning  Comp. Temp. Threshold:     82 Celsius
Critical Comp. Temp. Threshold:     85 Celsius
Namespace 1 Features (0x10):        *Other*

Supported Power States
St Op     Max   Active     Idle   RL RT WL WT  Ent_Lat  Ex_Lat
 0 +     5.24W       -        -    0  0  0  0        0       0
 1 +     4.49W       -        -    1  1  1  1        0       0
 2 +     2.19W       -        -    2  2  2  2        0     500
 3 -   0.0500W       -        -    3  3  3  3      210    1200
 4 -   0.0050W       -        -    4  4  4  4     1000    9000

Supported LBA Sizes (NSID 0x1)
Id Fmt  Data  Metadt  Rel_Perf
 0 +     512       0         0

=== START OF SMART DATA SECTION ===
SMART overall-health self-assessment test result: PASSED

SMART/Health Information (NVMe Log 0x02, NSID 0x1)
Critical Warning:                   0x00
Temperature:                        65 Celsius
Available Spare:                    100%
Available Spare Threshold:          10%
Percentage Used:                    11%
Data Units Read:                    2,894,660 [1.48 TB]
Data Units Written:                 92,071,189 [47.1 TB]
Host Read Commands:                 11,612,861
Host Write Commands:                77,542,270
Controller Busy Time:               1,740
Power Cycles:                       1
Power On Hours:                     136
Unsafe Shutdowns:                   0
Media and Data Integrity Errors:    0
Error Information Log Entries:      0
Warning  Comp. Temperature Time:    0
Critical Comp. Temperature Time:    0
Temperature Sensor 1:               65 Celsius
Temperature Sensor 2:               95 Celsius

Read Error Information Log failed: NVMe Status 0x02

